[
  {
    "additions": 0,
    "blob_url": "https://github.example/fernhill-oss/lamina/blob/f88ae4c11375ec589b4fef34daf2c551193efbf6/tests%2Fdata%2Ffixture197.conf.gz",
    "changes": 0,
    "contents_url": "https://api.github.example/repos/fernhill-oss/lamina/contents/tests%2Fdata%2Ffixture197.conf.gz?ref=f88ae4c11375ec589b4fef34daf2c551193efbf6",
    "deletions": 0,
    "filename": "tests/data/fixture197.conf.gz",
    "raw_url": "https://github.example/fernhill-oss/lamina/raw/f88ae4c11375ec589b4fef34daf2c551193efbf6/tests%2Fdata%2Ffixture197.conf.gz",
    "sha": "a5d83134a9a3b542985cfb163d21b22858dadae3",
    "status": "added"
  },
  {
    "additions": 11,
    "blob_url": "https://github.example/fernhill-oss/lamina/blob/f88ae4c11375ec589b4fef34daf2c551193efbf6/tests%2Ftest_fixture_fixture197.py",
    "changes": 11,
    "contents_url": "https://api.github.example/repos/fernhill-oss/lamina/contents/tests%2Ftest_fixture_fixture197.py?ref=f88ae4c11375ec589b4fef34daf2c551193efbf6",
    "deletions": 0,
    "filename": "tests/test_fixture_fixture197.py",
    "patch": "@@ -0,0 +1,11 @@\n+import gzip\n+import pathlib\n+\n+from lamina import loads\n+\n+DATA = pathlib.Path(__file__).parent / \"data\"\n+\n+\n+def test_fixture197_fixture_loads():\n+    text = gzip.decompress((DATA / \"fixture197.conf.gz\").read_bytes()).decode(\"utf-8\")\n+    assert loads(text).get(\"sample.name\") == \"fixture197\"",
    "raw_url": "https://github.example/fernhill-oss/lamina/raw/f88ae4c11375ec589b4fef34daf2c551193efbf6/tests%2Ftest_fixture_fixture197.py",
    "sha": "8fa73dea2874a75e6fbbfeb080653f73511240dc",
    "status": "added"
  }
]
