[
  {
    "additions": 35,
    "blob_url": "https://github.example/fernhill-oss/lamina/blob/939727578508217b0182d984844a474d9ca97a85/lamina%2Finclude%2Fprefixed.py",
    "changes": 35,
    "contents_url": "https://api.github.example/repos/fernhill-oss/lamina/contents/lamina%2Finclude%2Fprefixed.py?ref=939727578508217b0182d984844a474d9ca97a85",
    "deletions": 0,
    "filename": "lamina/include/prefixed.py",
    "patch": "@@ -0,0 +1,35 @@\n+\"\"\"Prefixed includes.\"\"\"\n+\n+import os\n+\n+from lamina.errors import IncludeError\n+\n+\n+def resolve_prefixed_include(base_dir: str, name: str, root: str, *, skip: list[str] | None = None) -> str:\n+    \"\"\"Resolve a prefixed include relative to base_dir, confined to root.\"\"\"\n+    skip = list(skip or [])\n+    skip.append(name)\n+    root_real = os.path.realpath(root)\n+    resolved_path = os.path.realpath(os.path.join(base_dir, name))\n+    if os.path.commonpath([resolved_path, root_real]) != root_real:\n+        raise IncludeError(f\"include escapes the project root: {name}\", 0, 1)\n+    if not os.path.isfile(resolved_path):\n+        raise IncludeError(f\"include not found: {name}\", 0, 1)\n+    return resolved_path\n+\n+\n+def read_prefixed_include(base_dir: str, name: str, root: str) -> str:\n+    \"\"\"Return the text of a prefixed include.\"\"\"\n+    path = resolve_prefixed_include(base_dir, name, root)\n+    with open(path) as fh:\n+        return fh.read()\n+\n+\n+def _walk_prefixed(base_dir: str, names: list[str], root: str, depth: int = 0) -> list[str]:\n+    \"\"\"Resolve a chain of includes, depth first.\"\"\"\n+    out: list[str] = []\n+    for name in names:\n+        out.append(resolve_prefixed_include(base_dir, name, root))\n+    if len(names) > 1:\n+        out.extend(_walk_prefixed(base_dir, names[1:], root, depth + 1))\n+    return out",
    "raw_url": "https://github.example/fernhill-oss/lamina/raw/939727578508217b0182d984844a474d9ca97a85/lamina%2Finclude%2Fprefixed.py",
    "sha": "afd579ef3d1e12e50178201076df11ea1af2c7a8",
    "status": "added"
  },
  {
    "additions": 13,
    "blob_url": "https://github.example/fernhill-oss/lamina/blob/939727578508217b0182d984844a474d9ca97a85/tests%2Ftest_include_prefixed.py",
    "changes": 13,
    "contents_url": "https://api.github.example/repos/fernhill-oss/lamina/contents/tests%2Ftest_include_prefixed.py?ref=939727578508217b0182d984844a474d9ca97a85",
    "deletions": 0,
    "filename": "tests/test_include_prefixed.py",
    "patch": "@@ -0,0 +1,13 @@\n+import pytest\n+\n+from lamina.include.prefixed import resolve_prefixed_include, read_prefixed_include\n+\n+\n+def test_prefixed_include_reads_file(tmp_path):\n+    (tmp_path / \"base.conf\").write_text(\"[a]\\nx = 1\\n\", encoding=\"utf-8\")\n+    assert \"x = 1\" in read_prefixed_include(str(tmp_path), \"base.conf\", str(tmp_path))\n+\n+\n+def test_prefixed_include_missing(tmp_path):\n+    with pytest.raises(Exception):\n+        resolve_prefixed_include(str(tmp_path), \"nope.conf\", str(tmp_path))",
    "raw_url": "https://github.example/fernhill-oss/lamina/raw/939727578508217b0182d984844a474d9ca97a85/tests%2Ftest_include_prefixed.py",
    "sha": "0db47fa9e56291cce4e32c0a63dadae7fc346740",
    "status": "added"
  }
]
