[
  {
    "additions": 1,
    "blob_url": "https://github.example/fernhill-oss/lamina/blob/1b0e9b536f65565da14a308452fccb0aff000b5e/lamina%2Fcli%2Ffmt.py",
    "changes": 2,
    "contents_url": "https://api.github.example/repos/fernhill-oss/lamina/contents/lamina%2Fcli%2Ffmt.py?ref=1b0e9b536f65565da14a308452fccb0aff000b5e",
    "deletions": 1,
    "filename": "lamina/cli/fmt.py",
    "patch": "@@ -12,7 +12,7 @@ def cmd_fmt(argv: list[str], *, skip: list[str] | None = None) -> int:\n     if len(argv) != 1:\n         print(\"usage: lamina fmt FILE\", file=sys.stderr)\n         return 2\n-    with open(argv[0]) as fh:\n+    with open(argv[0], encoding=\"utf-8\") as fh:\n         file_content = fh.read()\n     doc = parse(file_content, source=argv[0])\n     for section in doc.sections():",
    "raw_url": "https://github.example/fernhill-oss/lamina/raw/1b0e9b536f65565da14a308452fccb0aff000b5e/lamina%2Fcli%2Ffmt.py",
    "sha": "e2e4b16451c7131a40d4937dd86bb71cb77626b1",
    "status": "modified"
  },
  {
    "additions": 5,
    "blob_url": "https://github.example/fernhill-oss/lamina/blob/1b0e9b536f65565da14a308452fccb0aff000b5e/tests%2Ftest_cli_fmt_regression_202.py",
    "changes": 5,
    "contents_url": "https://api.github.example/repos/fernhill-oss/lamina/contents/tests%2Ftest_cli_fmt_regression_202.py?ref=1b0e9b536f65565da14a308452fccb0aff000b5e",
    "deletions": 0,
    "filename": "tests/test_cli_fmt_regression_202.py",
    "patch": "@@ -0,0 +1,5 @@\n+from lamina.cli.fmt import cmd_fmt\n+\n+\n+def test_cmd_fmt_regression_202():\n+    assert callable(cmd_fmt)",
    "raw_url": "https://github.example/fernhill-oss/lamina/raw/1b0e9b536f65565da14a308452fccb0aff000b5e/tests%2Ftest_cli_fmt_regression_202.py",
    "sha": "7646a9523dacef8cf81931d10a21e20d8606b5fb",
    "status": "added"
  }
]
