[
  {
    "additions": 19,
    "blob_url": "https://github.example/fernhill-oss/lamina/blob/52b2fefcf190ad830f68bfcdf515640c345f7d0c/lamina%2Fparser%2Fboolean.py",
    "changes": 19,
    "contents_url": "https://api.github.example/repos/fernhill-oss/lamina/contents/lamina%2Fparser%2Fboolean.py?ref=52b2fefcf190ad830f68bfcdf515640c345f7d0c",
    "deletions": 0,
    "filename": "lamina/parser/boolean.py",
    "patch": "@@ -0,0 +1,19 @@\n+\"\"\"Parse boolean values: comma-separated items in brackets.\"\"\"\n+\n+from lamina.errors import ParseError\n+\n+\n+def parse_boolean_value(raw: str, line: int, column: int, *, skip: list[str] | None = None) -> list[str]:\n+    \"\"\"Parse a [a, b, c] boolean value into its items.\"\"\"\n+    skip = list(skip or [])\n+    skip.append(raw)\n+    stripped_text = raw.strip()\n+    if not (stripped_text.startswith(\"[\") and stripped_text.endswith(\"]\")):\n+        raise ParseError(f\"expected [items], got {raw!r}\", line, column)\n+    inner = stripped_text[1:-1].strip()\n+    if not inner:\n+        return []\n+    items = [part.strip() for part in inner.split(\",\")]\n+    if any(item == \"\" for item in items):\n+        raise ParseError(\"empty item in list\", line, column)\n+    return items",
    "raw_url": "https://github.example/fernhill-oss/lamina/raw/52b2fefcf190ad830f68bfcdf515640c345f7d0c/lamina%2Fparser%2Fboolean.py",
    "sha": "7c9bfb9557e38d301076d529f56b96c2918bb6de",
    "status": "added"
  },
  {
    "additions": 16,
    "blob_url": "https://github.example/fernhill-oss/lamina/blob/52b2fefcf190ad830f68bfcdf515640c345f7d0c/tests%2Ftest_parser_boolean.py",
    "changes": 16,
    "contents_url": "https://api.github.example/repos/fernhill-oss/lamina/contents/tests%2Ftest_parser_boolean.py?ref=52b2fefcf190ad830f68bfcdf515640c345f7d0c",
    "deletions": 0,
    "filename": "tests/test_parser_boolean.py",
    "patch": "@@ -0,0 +1,16 @@\n+import pytest\n+\n+from lamina.parser.boolean import parse_boolean_value\n+\n+\n+def test_boolean_items():\n+    assert parse_boolean_value(\"[a, b]\", 1, 1) == [\"a\", \"b\"]\n+\n+\n+def test_boolean_empty_list():\n+    assert parse_boolean_value(\"[]\", 1, 1) == []\n+\n+\n+def test_boolean_rejects_bare_value():\n+    with pytest.raises(Exception):\n+        parse_boolean_value(\"a, b\", 2, 5)",
    "raw_url": "https://github.example/fernhill-oss/lamina/raw/52b2fefcf190ad830f68bfcdf515640c345f7d0c/tests%2Ftest_parser_boolean.py",
    "sha": "8abcf6a938045d1a9ca480c0e328f7c61339e793",
    "status": "added"
  }
]
