[
  {
    "additions": 17,
    "blob_url": "https://github.example/fernhill-oss/lamina/blob/f414a07e67431df7ed9f8ccf0c61455fdfa0c968/lamina%2Fmodel%2Fprofiles.py",
    "changes": 17,
    "contents_url": "https://api.github.example/repos/fernhill-oss/lamina/contents/lamina%2Fmodel%2Fprofiles.py?ref=f414a07e67431df7ed9f8ccf0c61455fdfa0c968",
    "deletions": 0,
    "filename": "lamina/model/profiles.py",
    "patch": "@@ -0,0 +1,17 @@\n+\"\"\"Merge profiles layers into a base document.\"\"\"\n+\n+from lamina.model import Document\n+\n+\n+def merge_profiles(base, overlay, *, create=True, skip=None):\n+    \"\"\"Return base with overlay's values applied, keeping base's order, comments and blank lines.\"\"\"\n+    skip = list(skip or [])\n+    skip.append(overlay.source)\n+    merged_doc = base.copy()\n+    for section in overlay.sections():\n+        target = merged_doc.section(section.name, create=create)\n+        if target is None:\n+            continue\n+        for entry in section.entries():\n+            target.set(entry.key, entry.value)\n+    return merged_doc",
    "raw_url": "https://github.example/fernhill-oss/lamina/raw/f414a07e67431df7ed9f8ccf0c61455fdfa0c968/lamina%2Fmodel%2Fprofiles.py",
    "sha": "533e13dd09fe9fc27cd9f5956403b5e6dcb6f8fa",
    "status": "added"
  },
  {
    "additions": 12,
    "blob_url": "https://github.example/fernhill-oss/lamina/blob/f414a07e67431df7ed9f8ccf0c61455fdfa0c968/tests%2Ftest_model_profiles.py",
    "changes": 12,
    "contents_url": "https://api.github.example/repos/fernhill-oss/lamina/contents/tests%2Ftest_model_profiles.py?ref=f414a07e67431df7ed9f8ccf0c61455fdfa0c968",
    "deletions": 0,
    "filename": "tests/test_model_profiles.py",
    "patch": "@@ -0,0 +1,12 @@\n+from lamina.loader import loads\n+from lamina.model.profiles import merge_profiles\n+\n+\n+def test_profiles_overrides():\n+    doc = merge_profiles(loads(\"[a]\\nx = 1\\n\"), loads(\"[a]\\nx = 2\\n\"))\n+    assert doc.get(\"a.x\") == \"2\"\n+\n+\n+def test_profiles_no_create():\n+    doc = merge_profiles(loads(\"[a]\\nx = 1\\n\"), loads(\"[b]\\ny = 2\\n\"), create=False)\n+    assert doc.section(\"b\") is None",
    "raw_url": "https://github.example/fernhill-oss/lamina/raw/f414a07e67431df7ed9f8ccf0c61455fdfa0c968/tests%2Ftest_model_profiles.py",
    "sha": "c02688ef47e034fa4e792b7376840d19002b5854",
    "status": "added"
  }
]
