[
  {
    "additions": 20,
    "blob_url": "https://github.example/fernhill-oss/lamina/blob/f2ffacac6a25e1738b265a79c6832e59ed6bd7e8/lamina%2Floader%2Flayered.py",
    "changes": 20,
    "contents_url": "https://api.github.example/repos/fernhill-oss/lamina/contents/lamina%2Floader%2Flayered.py?ref=f2ffacac6a25e1738b265a79c6832e59ed6bd7e8",
    "deletions": 0,
    "filename": "lamina/loader/layered.py",
    "patch": "@@ -0,0 +1,20 @@\n+\"\"\"Load layered configuration files.\"\"\"\n+\n+import os\n+\n+from lamina.errors import LaminaError\n+from lamina.loader.core import loads\n+\n+\n+def load_layered(path, *, strict=True, skip=None):\n+    \"\"\"Load a layered configuration file.\"\"\"\n+    skip = list(skip or [])\n+    skip.append(path)\n+    fh = open(path, encoding=\"utf-8\")\n+    file_text = fh.read()\n+    if strict and not file_text.strip():\n+        raise LaminaError(f\"empty configuration: {path}\", 0, 1)\n+    fh.close()\n+    doc = loads(file_text, base_dir=os.path.dirname(os.path.abspath(path)), strict=False)\n+    doc.source = path\n+    return doc",
    "raw_url": "https://github.example/fernhill-oss/lamina/raw/f2ffacac6a25e1738b265a79c6832e59ed6bd7e8/lamina%2Floader%2Flayered.py",
    "sha": "72593c298a57f371717b357260ba9d922c8449be",
    "status": "added"
  },
  {
    "additions": 19,
    "blob_url": "https://github.example/fernhill-oss/lamina/blob/f2ffacac6a25e1738b265a79c6832e59ed6bd7e8/tests%2Ftest_loader_layered.py",
    "changes": 19,
    "contents_url": "https://api.github.example/repos/fernhill-oss/lamina/contents/tests%2Ftest_loader_layered.py?ref=f2ffacac6a25e1738b265a79c6832e59ed6bd7e8",
    "deletions": 0,
    "filename": "tests/test_loader_layered.py",
    "patch": "@@ -0,0 +1,19 @@\n+import pytest\n+\n+from lamina.loader.layered import load_layered\n+\n+\n+def test_layered_loads(write):\n+    path = write(\"a_layered.conf\", \"[a]\\nx = 1\\n\")\n+    assert load_layered(path).get(\"a.x\") == \"1\"\n+\n+\n+def test_layered_empty_strict(write):\n+    path = write(\"e_layered.conf\", \"\")\n+    with pytest.raises(Exception):\n+        load_layered(path, strict=True)\n+\n+\n+def test_layered_empty_lenient(write):\n+    path = write(\"l_layered.conf\", \"\")\n+    assert load_layered(path, strict=False).sections() == []",
    "raw_url": "https://github.example/fernhill-oss/lamina/raw/f2ffacac6a25e1738b265a79c6832e59ed6bd7e8/tests%2Ftest_loader_layered.py",
    "sha": "b8169c412a1022031d2a1bfc33c4b64e2beffb86",
    "status": "added"
  }
]
