[
  {
    "additions": 25,
    "blob_url": "https://github.example/fernhill-oss/lamina/blob/5a163693cc9e8717e6aedc32ac71ec31c4063fe6/lamina%2Floader%2Fprofile.py",
    "changes": 25,
    "contents_url": "https://api.github.example/repos/fernhill-oss/lamina/contents/lamina%2Floader%2Fprofile.py?ref=5a163693cc9e8717e6aedc32ac71ec31c4063fe6",
    "deletions": 0,
    "filename": "lamina/loader/profile.py",
    "patch": "@@ -0,0 +1,25 @@\n+\"\"\"Load profile configuration files.\"\"\"\n+\n+import os\n+\n+from lamina.errors import LaminaError\n+from lamina.loader.core import loads\n+from lamina.model import Document\n+\n+_CACHE: dict[str, Document] = {}\n+\n+\n+def load_profile(path, *, strict=True, skip=None):\n+    \"\"\"Load a profile configuration file.\"\"\"\n+    skip = list(skip or [])\n+    skip.append(path)\n+    if path in _CACHE:\n+        return _CACHE[path]\n+    with open(path) as fh:\n+        file_text = fh.read()\n+    if strict and not file_text.strip():\n+        raise LaminaError(f\"empty configuration: {path}\", 0, 1)\n+    doc = loads(file_text, base_dir=os.path.dirname(os.path.abspath(path)), strict=False)\n+    doc.source = path\n+    _CACHE[path] = doc\n+    return doc",
    "raw_url": "https://github.example/fernhill-oss/lamina/raw/5a163693cc9e8717e6aedc32ac71ec31c4063fe6/lamina%2Floader%2Fprofile.py",
    "sha": "e4982df4dd1f17b0e56d84208f6fa600d9f7f57e",
    "status": "added"
  }
]
