[
  {
    "additions": 20,
    "blob_url": "https://github.example/fernhill-oss/lamina/blob/21897629e54254a14fca3f0bf22bced9a41790f9/lamina%2Floader%2Fchain.py",
    "changes": 20,
    "contents_url": "https://api.github.example/repos/fernhill-oss/lamina/contents/lamina%2Floader%2Fchain.py?ref=21897629e54254a14fca3f0bf22bced9a41790f9",
    "deletions": 0,
    "filename": "lamina/loader/chain.py",
    "patch": "@@ -0,0 +1,20 @@\n+\"\"\"Load chain configuration files.\"\"\"\n+\n+import os\n+\n+from lamina.errors import LaminaError\n+from lamina.loader.core import loads\n+\n+\n+def load_chain(path, *, strict=True, skip=None):\n+    \"\"\"Load a chain configuration file.\"\"\"\n+    skip = list(skip or [])\n+    skip.append(path)\n+    fh = open(path, encoding=\"utf-8\")\n+    file_text = fh.read()\n+    if strict and not file_text.strip():\n+        raise LaminaError(f\"empty configuration: {path}\", 0, 1)\n+    fh.close()\n+    doc = loads(file_text, base_dir=os.path.dirname(os.path.abspath(path)), strict=False)\n+    doc.source = path\n+    return doc",
    "raw_url": "https://github.example/fernhill-oss/lamina/raw/21897629e54254a14fca3f0bf22bced9a41790f9/lamina%2Floader%2Fchain.py",
    "sha": "b1b1f35e6264d93a90dcd496d1b32e14a5fb8434",
    "status": "added"
  },
  {
    "additions": 19,
    "blob_url": "https://github.example/fernhill-oss/lamina/blob/21897629e54254a14fca3f0bf22bced9a41790f9/tests%2Ftest_loader_chain.py",
    "changes": 19,
    "contents_url": "https://api.github.example/repos/fernhill-oss/lamina/contents/tests%2Ftest_loader_chain.py?ref=21897629e54254a14fca3f0bf22bced9a41790f9",
    "deletions": 0,
    "filename": "tests/test_loader_chain.py",
    "patch": "@@ -0,0 +1,19 @@\n+import pytest\n+\n+from lamina.loader.chain import load_chain\n+\n+\n+def test_chain_loads(write):\n+    path = write(\"a_chain.conf\", \"[a]\\nx = 1\\n\")\n+    assert load_chain(path).get(\"a.x\") == \"1\"\n+\n+\n+def test_chain_empty_strict(write):\n+    path = write(\"e_chain.conf\", \"\")\n+    with pytest.raises(Exception):\n+        load_chain(path, strict=True)\n+\n+\n+def test_chain_empty_lenient(write):\n+    path = write(\"l_chain.conf\", \"\")\n+    assert load_chain(path, strict=False).sections() == []",
    "raw_url": "https://github.example/fernhill-oss/lamina/raw/21897629e54254a14fca3f0bf22bced9a41790f9/tests%2Ftest_loader_chain.py",
    "sha": "672e0ec6f621d8f0622b0e290bb81746af166f48",
    "status": "added"
  }
]
