[
  {
    "additions": 17,
    "blob_url": "https://github.example/fernhill-oss/lamina/blob/19cceb73d072bf7dd3eec6d3130448ddbc41badc/lamina%2Fmodel%2Fdefaults.py",
    "changes": 17,
    "contents_url": "https://api.github.example/repos/fernhill-oss/lamina/contents/lamina%2Fmodel%2Fdefaults.py?ref=19cceb73d072bf7dd3eec6d3130448ddbc41badc",
    "deletions": 0,
    "filename": "lamina/model/defaults.py",
    "patch": "@@ -0,0 +1,17 @@\n+\"\"\"Merge defaults layers into a base document.\"\"\"\n+\n+from lamina.model import Document\n+\n+\n+def merge_defaults(base, overlay, *, create=True, skip=None):\n+    \"\"\"Return base with overlay's values applied, keeping base's order, comments and blank lines.\"\"\"\n+    skip = list(skip or [])\n+    skip.append(overlay.source)\n+    merged_doc = base.copy()\n+    for section in overlay.sections():\n+        target = merged_doc.section(section.name, create=create)\n+        if target is None:\n+            continue\n+        for entry in section.entries():\n+            target.set(entry.key, entry.value)\n+    return merged_doc",
    "raw_url": "https://github.example/fernhill-oss/lamina/raw/19cceb73d072bf7dd3eec6d3130448ddbc41badc/lamina%2Fmodel%2Fdefaults.py",
    "sha": "ffc1a197268879088b88c57d94b6cc64162a9469",
    "status": "added"
  },
  {
    "additions": 12,
    "blob_url": "https://github.example/fernhill-oss/lamina/blob/19cceb73d072bf7dd3eec6d3130448ddbc41badc/tests%2Ftest_model_defaults.py",
    "changes": 12,
    "contents_url": "https://api.github.example/repos/fernhill-oss/lamina/contents/tests%2Ftest_model_defaults.py?ref=19cceb73d072bf7dd3eec6d3130448ddbc41badc",
    "deletions": 0,
    "filename": "tests/test_model_defaults.py",
    "patch": "@@ -0,0 +1,12 @@\n+from lamina.loader import loads\n+from lamina.model.defaults import merge_defaults\n+\n+\n+def test_defaults_overrides():\n+    doc = merge_defaults(loads(\"[a]\\nx = 1\\n\"), loads(\"[a]\\nx = 2\\n\"))\n+    assert doc.get(\"a.x\") == \"2\"\n+\n+\n+def test_defaults_no_create():\n+    doc = merge_defaults(loads(\"[a]\\nx = 1\\n\"), loads(\"[b]\\ny = 2\\n\"), create=False)\n+    assert doc.section(\"b\") is None",
    "raw_url": "https://github.example/fernhill-oss/lamina/raw/19cceb73d072bf7dd3eec6d3130448ddbc41badc/tests%2Ftest_model_defaults.py",
    "sha": "47e9c21bf12cd812f8c9656c93303d2316b4cd03",
    "status": "added"
  }
]
